{
  "manifest_version": "1.0.0",
  "manifest_id": "lsm:zr-portal:2026-05-20:3fb51a9e",
  "provenance": {
    "source_id": "nyc-zr-portal",
    "publisher": "NYC DCP",
    "provenance_tier": 1,
    "legal_status": "effective",
    "jurisdiction": "NYC",
    "scope": "citywide",
    "canonical_url": "https://zoningresolution.planning.nyc.gov/",
    "access_mode": "html_corpus_ingestion",
    "retrieved_at": "2026-07-23T12:00:00Z",
    "effective_date": null,
    "as_of_date": "2026-05-20"
  },
  "corpus_version": "zr-banner-2026-05-20",
  "raw_capture": {
    "raw_sha256": "sha256:3fb51a9ec788cd567abf2e4aec1e72566f963a1ce059b733fdcf5d7c2f0eefe5",
    "media_type": "text/html",
    "byte_size": 482913,
    "storage_ref": null
  },
  "status": "to_verify_at_g1",
  "cross_check_only": false,
  "notes": "ZR official text portal HTML capture; currency = homepage banner date (as_of_date). Not yet verified; capture is M3-T002, evidence verification is M3-T003."
}
